text,count
กระทู้คำถาม ,50403
กระทู้สนทนา ,13738
บ้าน,2525
หุ้น,2500
อสังหาริมทรัพย์,2479
มนุษย์เงินเดือน,2282
ปัญหาชีวิต,1838
คอนโดมิเนียม,1809
สินเชื่อเพื่อที่อยู่อาศัย,1667
การเงิน,1639
รถยนต์,1610
การลงทุน,1533
ธนาคาร,1496
ความรักวัยทำงาน,1466
ปัญหาความรัก,1421
กฎหมายชาวบ้าน,1355
เที่ยวต่างประเทศ,1293
ปัญหาสังคม,1270
ฟุตบอล,1191
สมาร์ทโฟน,1101
เจ้าของธุรกิจ,1086
โทรศัพท์มือถือ,1081
สุขภาพกาย,1052
ประสบการณ์ชีวิตคู่,1003
ความรักวัยรุ่น,999
คุ้มครองผู้บริโภค,964
ฟุตบอลไทย,928
ชีวิตวัยรุ่น,924
ร้องทุกข์,823
ดูแลและซ่อมแซมบ้าน,820
อินเทอร์เน็ต,819
ที่ดิน,808
AIS,788
การจราจร,775
ออกแบบและสร้างบ้าน,755
เครื่องใช้ไฟฟ้า,754
สุขภาพจิต,752
วิทยาศาสตร์,746
กรุงเทพมหานคร,726
กระทู้ข่าว ,725
truemove H,724
ทรัพยากรบุคคล,708
บัตรเครดิต,707
ตกแต่งบ้าน,692
เศรษฐกิจ,681
มอเตอร์ไซค์,675
dtac,665
ปัญหาครอบครัว,646
อาหาร,646
การศึกษา,645
ฟุตบอลต่างประเทศ,638
ครอบครัว,627
แพทย์,621
เที่ยวไทย,611
ความงาม,591
ภาพยนตร์,591
ร้านอาหาร,579
มหาวิทยาลัย,571
การบริหารจัดการ,570
Mobile Operator,552
ศาลาคนเศร้า,534
iPhone,532
อาวุธยุทโธปกรณ์,528
หาเพื่อน,521
ซ่อมบำรุงรถยนต์,514
ศาสนาพุทธ,508
Backpack,500
การเรียน,495
ละครโทรทัศน์,492
คอมพิวเตอร์,489
กระทู้รีวิว ,488
ตลาดหลักทรัพย์,487
เทคโนโลยี,480
งานขาย,470
แผนที่เดินทาง,468
รีโนเวทบ้าน,463
โรงพยาบาล,461
หน้าต่างโลก,459
สายการบิน,454
ดูดวง,449
คอมมือใหม่,448
การตลาด,446
ระบบขนส่งมวลชน,444
Android,440
การออมเงิน,436
พนักงานบริษัท,415
พรีเมียร์ลีก,407
แอบรัก,404
ประวัติศาสตร์,402
อิเล็กทรอนิกส์,399
สโมสรฟุตบอลอังกฤษ,398
อุบัติเหตุบนท้องถนน,394
นักแสดง,393
เที่ยวญี่ปุ่น,387
วิศวกรรมศาสตร์,387
iOS,378
บริษัทพัฒนาอสังหาริมทรัพย์,374
4G,368
สนามบิน,367
สัตว์เลี้ยง,366
ไทยพรีเมียร์ลีก,366
เตือนภัย,362
ซอฟต์แวร์,353
truemove,348
Mobile Application,345
รัฐบาล,345
Social Network,344
ฮาร์ดแวร์,337
โภชนาการ,329
อะไหล่รถ,328
Value Investment,328
ประเทศญี่ปุ่น,320
อู่ซ่อมรถ,319
หอพัก,316
รถโดยสาร,316
ภาพยนตร์ต่างประเทศ,313
ชีวิตในต่างแดน,313
แฟชั่น,311
ความเชื่อส่วนบุคคล,309
อพาร์ตเมนต์,308
สโมสรฟุตบอลไทย,304
ฟิตเนส,302
วิชาการ,300
เพื่อนวัยเรียน,299
รถโดยสารประจำทาง,299
SME,295
ชีววิทยา,295
โรงแรมรีสอร์ท,291
Samsung Smartphone,287
รายการโทรทัศน์,284
ภาษาอังกฤษ,284
ภาษีเงินได้บุคคลธรรมดา,282
โหราศาสตร์,281
ศาสนา,281
บันทึกนักเดินทาง,279
Hurt Room,276
รายการข่าว,273
ลดความอ้วน,273
Skin Care,270
สังคมชาวพันทิป,270
ธนาคารอาคารสงเคราะห์,269
Network,269
ยา,266
เฟอร์นิเจอร์,265
สังคมคุณแม่,261
เครื่องสำอาง,260
DIY เครื่องใช้ในบ้าน,257
เพลง,256
ภูมิศาสตร์,255
กีฬา,255
ธุรกรรมทางการเงิน,255
เกม,255
วัสดุก่อสร้าง,254
จังหวัดเชียงใหม่,253
รัฐศาสตร์,250
เพศที่สาม,248
7 HD,243
อาหารไทย,243
ศาลาคนโสด,243
ต้นไม้,242
เพื่อนร่วมงาน,241
งานช่าง,234
อุปกรณ์เครื่องใช้ภายในบ้าน,234
กระทู้โพล ,234
คลับสุขภาพ,234
ความบันเทิงในบ้าน,232
โฉนดที่ดิน,230
ทำอาหาร,230
แต่งรถ,230
คนไทยในญี่ปุ่น,227
สถานีโทรทัศน์,227
งานค้าขาย,226
งานราชการ,225
true online,224
Men's Fashion,223
แมว,222
ปฏิบัติธรรม,222
โรงเรียน,219
ที่พัก,219
Technical Analysis,218
Wi-Fi,218
กองทุนรวม,218
สินเชื่อส่วนบุคคล,216
บริษัทหลักทรัพย์,214
Facebook,213
การเมือง,212
ปัญหาวัยรุ่น,212
คู่สมพงษ์,212
หมอดู,211
สินเชื่อรถยนต์,211
รถกระบะ,211
งานบ้าน,210
E-commerce,210
รถไฟฟ้า BTS,210
Honda (รถยนต์),209
Android App,209
ออกกำลังกาย,208
การ์ตูน,207
วีซ่า,207
สุนัข,206
สถานที่ท่องเที่ยวต่างประเทศ,206
ประเทศไทย,205
ภาษาต่างประเทศ,205
ซีรีส์,205
วิ่งเพื่อสุขภาพ,204
เครื่องดื่ม,203
จักรยาน,203
นักกีฬา,203
วัด,202
การ์ตูนญี่ปุ่น,202
สินเชื่อธุรกิจ,201
คลินิกความงาม,200
เที่ยวทะเล,199
รถไฟ,199
ไฟฟ้า,199
Toyota,198
ประสบการณ์ความรัก,196
การเลี้ยงลูก,195
ข่าวออนไลน์,191
The Mask Singer หน้ากากนักร้อง (รายการโทรทัศน์),191
คอมพิวเตอร์แล็ปท็อป,189
เที่ยวภูเขา,182
AIS Fibre,182
ย้ายค่ายเบอร์เดิม,180
ธนาคารไทยพาณิชย์,180
BEC (ช่อง 3),180
สถานที่ท่องเที่ยวในประเทศ,179
เศรษฐศาสตร์,178
นักแสดงหญิง,178
ทำบุญ,178
ธนาคารกสิกรไทย,175
เกษตรกรรม,175
จัดสวน,174
ศัลยกรรมความงาม,172
ประวัติศาสตร์ไทย,171
เครื่องครัว,167
นำเข้าส่งออก,167
iPhone App,163
ตกแต่งคอนโดมิเนียม,163
ภาคเหนือ,163
หนังสือ,162
ซีรีส์ฝรั่ง,161
รีไฟแนนซ์,160
นักร้องนักดนตรี,159
ประกันภัยรถ,157
วอลเลย์บอล,155
เกมคอมพิวเตอร์,154
การสอนลูก,154
เคมี,154
รายการกีฬา,153
ตั้งครรภ์,152
บัญชี,151
ทำงานต่างประเทศ,150
นักแสดงไทย,150
ของหวาน,150
3G,150
LINE,149
3BB,149
ดูแลรักษารถยนต์,148
ฟุตบอลเอเชีย,147
พระไตรปิฎก,147
กล้อง DSLR,146
ผลิตภัณฑ์ดูแลผิวหน้า,146
ประกันสุขภาพ,146
สิว,146
ดูดวงไพ่ยิปซี,146
แต่งงาน,145
อาหารเสริม,144
รถไฟฟ้า MRT,143
ธุรกรรมออนไลน์,142
คนไทยในอเมริกา,140
สูตรอาหาร,140
Fundamental Analysis,138
Gadget,138
Mobile OS,137
เครื่องปรับอากาศ,136
ดนตรี,136
ห้างสรรพสินค้า,136
ภาษาไทย,133
แต่งหน้า,131
Workpoint TV,130
Manchester United F.C.,130
ฟิสิกส์,130
สถานที่ท่องเที่ยวสำหรับครอบครัว,129
ดูดวงตามวันเกิด,128
อาหารบุฟเฟ่ต์,127
ปรัชญา,127
ทันตกรรม,126
แนะแนวการศึกษา,126
อวกาศ,126
คอมพิวเตอร์แบบตั้งโต๊ะ,125
3 HD (BEC),125
ที่จอดรถ,124
กล้องถ่ายรูป,124
เครดิตบูโร,124
การโฆษณา,123
ช่วยเหลือสัตว์,123
โรคผิวหนัง,123
จิตอาสา,123
TFEX (Thailand Future Exchange),123
โรคซึมเศร้า,122
ประกันสังคม,122
ธนาคารกรุงศรีอยุธยา,122
ธนาคารกรุงไทย,121
กล้อง Mirrorless,121
จังหวัดนนทบุรี,121
กรมสรรพากร,120
ธุรกิจอสังหาริมทรัพย์,120
นักฟุตบอล,120
เพื่อนบ้าน,118
สัมภาษณ์งาน,117
ระบบรักษาความปลอดภัยในบ้าน,117
อุปกรณ์กล้อง,117
แท็บเล็ต,117
Mazda,117
ช่างภาพ,116
ดูดวงความรัก,115
Big Bike,115
ราศี,114
กาแฟ,114
โรงภาพยนตร์,113
สิ่งลี้ลับ (mystery),112
ประชาคมเศรษฐกิจอาเซียน (AEC),111
ฮวงจุ้ย,111
นักการเมือง,111
ทำผม,111
The Face Thailand,110
อาหารคาว,110
Microsoft Windows,110
iPad,110
คณิตศาสตร์,110
ประเทศจีน,109
รถมือสอง,108
วิศวกร,107
กฎหมายแรงงาน,107
ขนส่งสินค้า,106
ภาษีที่ดินและสิ่งปลูกสร้าง,106
วางแผนครอบครัว,105
ฟุตบอลโลก,104
คนไทยในจีน,104
ไปรษณีย์ไทย,103
จัดสเป็คคอม,102
กล้องดิจิตอล,102
การวางแผนการเงิน,102
ผลิตภัณฑ์ดูแลผิว,101
วิ่ง,101
พัฒนาการเด็ก,100
ประกอบคอมพิวเตอร์,100
โรคในผู้สูงอายุ,99
นักวิทยาศาสตร์,99
Samsung Galaxy Note,98
อาหารญี่ปุ่น,98
จังหวัดชลบุรี,98
น้ำมันเชื้อเพลิง,97
หย่าร้าง,97
ADSL,97
นักร้องนักดนตรีเกาหลี,96
อาหารปิ้งย่าง,95
เภสัชกร,95
ดาราศาสตร์,95
ภาคใต้,95
โทรทัศน์,95
ทางลัด,94
งานฝีมือ,94
ชิ้นส่วนคอมพิวเตอร์,94
โตเกียว,94
นักแปล,93
แท็กซี่,93
เรียนต่อต่างประเทศ,93
Honda (มอเตอร์ไซค์),93
7-Eleven,92
ความรักเพศที่สาม,92
นักร้องนักดนตรีไทย,92
AIS 4G ADVANCED,92
ภาพยนตร์แอ็คชั่น,92
ติวเตอร์,91
dtac TriNet,91
เทคนิคการถ่ายรูป,91
Samsung,91
เกมออนไลน์,90
การพัฒนาสังคม (Social Development),90
Huawei Smartphone,89
เลนส์กล้อง,89
แอดมิชชั่น,89
เงินตราต่างประเทศ,89
Online Travel Agency,88
สหรัฐอเมริกา,88
เพลงสากล,88
พยาบาล,88
เบเกอรี่,87
Chat,86
งานแสดงและจำหน่ายสินค้าไอที,86
บริษัทไอที,85
กราฟิกดีไซน์ (Graphic Design),85
ผลิตภัณฑ์ดูแลเส้นผม,85
ข้าราชการครู,85
Air Asia,85
Web Browser,84
นักแสดงภาพยนตร์,83
ภูมิอากาศ,83
TrueVisions,82
มหาสติปัฏฐาน 4,81
ดอกไม้,81
บัตรกดเงินสด,81
ธนาคารออมสิน,81
กล้อง Nikon,80
ป้องกันน้ำท่วมบ้าน,80
คนไทยในอังกฤษ,80
เครื่องมือช่าง,80
ซีรีส์เกาหลี,80
มวยไทย,79
รายการวาไรตี้โชว์,79
อนิเมะ,79
เรื่องลึกลับ,79
นักแสดงชาย,79
อนุรักษ์สิ่งแวดล้อม,79
ภาพถ่าย,79
FTTx,79
นักกฎหมาย,78
ร้านกาแฟ,78
นักเรียน,78
เทนนิส,78
Premier League (League),77
วัตถุดิบทำอาหาร,77
นักท่องเที่ยว,77
ผู้สูงอายุ,77
ศิลปะการต่อสู้,77
Nissan,76
ทำนายฝัน,76
หนังสือการ์ตูน,76
Microsoft Office,76
การพัฒนาซอฟต์แวร์,76
นิยายจีน,75
ของสะสม,75
อาหารซีฟู้ด,75
เซอร์วิสอพาร์ตเมนต์,74
ภาพยนตร์ไทย,74
ภาษีนิติบุคคล,74
ชีวประวัติบุคคล,74
YouTube,74
Smart TV,74
LAN,74
อุบัติเหตุ,74
Hard Disk,73
เค-ป็อป,73
Router,73
เครื่องปรุง,73
กายภาพบำบัด,73
ประเทศเกาหลีใต้,73
ภาษาจีน,73
เกษตรอินทรีย์,72
จังหวัดปทุมธานี,72
ภาพยนตร์ระทึกขวัญ,72
โรคภูมิแพ้,72
เที่ยวยุโรป,72
โทรศัพท์,71
กรมที่ดิน,71
สลากกินแบ่งรัฐบาล,70
Printer,70
Windows 10,70
ธุรกิจส่วนตัว,70
ผลไม้,70
เที่ยววัด,69
รองเท้า,69
ธนาคารทหารไทย,69
กล้อง Canon,69
กฎหมายการเมือง,69
กวดวิชา,69
ธรรมกาย,68
งานรัฐวิสาหกิจ,68
สินเชื่อระยะยาว,68
เรื่องเล่าสยองขวัญ,68
อาหารฝรั่ง,68
หนี้สิน (Liability),67
พิธีกรรมทางศาสนา,67
พระเครื่อง,67
ภาคกลาง,67
ภาษาญี่ปุ่น,67
LTF,67
ศูนย์บริการรถยนต์,66
ภาคอีสาน,66
ร้านสะดวกซื้อ,66
นิติบุคคลอาคารชุด,65
ซีรีส์จีน,65
สโมสรฟุตบอลเอสซีจี เมืองทอง ยูไนเต็ด,65
วิธีการใช้งานพันทิป,64
ซีรีส์ฮ่องกง-ไต้หวัน,64
เครื่องเสียงรถยนต์,64
ประเทศสิงคโปร์,64
จังหวัดสมุทรปราการ,64
Liverpool F.C.,64
PlayStation,64
คนรักต่างชาติ,63
ศิลปะ,63
น้ำหอม,63
Mac,63
นาฬิกา,63
ภาพยนตร์แอนิเมชัน,63
อาหารจีน,63
